title,subreddit,score,num_comments,created_dt
Aussies are mentality monsters,CricketShitpost,12418,761,2023-11-19 15:19:08
It hurts,IndiaCricket,10234,747,2023-11-19 16:02:19
Australia are champions of the 2023 ODI World Cup,Cricket,9948,3278,2023-11-19 15:51:22
"No matter how old, this habit will never go away",IndiaCricket,8699,121,2023-11-20 19:57:34
Another Heartbreak for India in ICC events,Cricket,7835,1447,2023-11-19 15:56:01
Australian Team with the World Cup Trophy.,Cricket,5346,548,2023-11-19 16:52:40
"Sean Abbott to Rinku Singh, SIX! RINKU SINGH DOES IT! This is full and on middle, Singh tonks it high over long on for a biggie. That was so clean. INDIA WIN BY 2 WICKETS.",IndiaCricket,4866,215,2023-11-23 17:17:42
This. This is what will haunt me. ,IndiaCricket,4572,288,2023-11-19 16:29:57
Mohammed Shami reacts to Mitchell Marsh's viral picture with World Cup trophy,Cricket,3767,1126,2023-11-24 10:01:10
Denial is one the stages of Grief.What is this behaviour Kaif?,CricketShitpost,2853,318,2023-11-19 16:15:45
