title,subreddit,score,num_comments,created_dt
"A scene for ages, an absolute cinema of a World Cup!",IndiaCricket,18710,291,2024-06-29 19:08:16
Rohit Sharma announces his T20I retirement ,Cricket,13559,703,2024-06-29 20:18:58
Surely will give goosebumps man!!!!!!,IndiaCricket,13206,335,2024-07-04 19:12:16
India are the champions of T20 World Cup 2024,Cricket,10893,1265,2024-06-29 18:02:03
Madness in Mumbai.,Cricket,9098,593,2024-07-04 16:16:13
Real Men Don't cry. Then I saw my heroes lik this.,IndiaCricket,8952,205,2024-07-01 18:03:58
"Won't let the bus move, won't let the ambulance stop.",IndiaCricket,8801,170,2024-07-04 13:43:26
"If it doesn’t give you chills, i don’t know what will!!",MumbaiIndians,7114,193,2024-06-30 07:13:22
ROHIT SHARMA RAW ECSTATIC MOMENTS AFTER WINNING THE CUP ,MumbaiIndians,6494,97,2024-06-29 18:37:43
Surya Kumar Yadav dancing in Delhi ,IndiaCricket,6234,125,2024-07-04 03:05:35
